{
  "resolution_number": "1559",
  "url": "https://undocs.org/en/S/RES/1559(2004)",
  "full_text": "United Nations S/RES/1559 (2004)\n Security Council Distr.: General\n2 September 2004\n04-49892 (E)\n*0449892*Resolution 1559 (2004)\nAdopted by the Security Coun cil at its 5028th meeting, on\n2 September 2004\nThe Security Council ,\nRecalling all its previous resolutions on Lebanon, in particular resolutions 425\n(1978) and 426 (1978) of 19 March 1978, re solution 520 (1982) of 17 September\n1982, and resolution 1553 (2004) of 29 July 2004 as well as the statements of itsPresident on the situation in Lebanon, in particular the statement of 18 June 2000\n(S/PRST/2000/21),\nReiterating its strong support for the territorial integrity, sovereignty and\npolitical independence of Lebanon within its internationally recognized borders,\nNoting the determination of Lebanon to ensure the withdrawal of all non-\nLebanese forces from Lebanon,\nGravely concerned at the continued presence of armed militias in Lebanon,\nwhich prevent the Lebanese Government from exercising its full sovereignty overall Lebanese territory,\nReaffirming the importance of the extension of the control of the Government\nof Lebanon over all Lebanese territory,\nMindful of the upcoming Lebanese presidential elections and underlining the\nimportance of free and fair elections a ccording to Lebanese constitutional rules\ndevised without foreign interference or influence,\n1. Reaffirms its call for the strict respect of the sovereignty, territorial\nintegrity, unity, and political independence of Lebanon under the sole and exclusiveauthority of the Government of Lebanon throughout Lebanon;\n2. Calls upon all remaining foreign forces to withdraw from Lebanon;\n3. Calls for the disbanding and disarmament of all Lebanese and non-\nLebanese militias;\n4. Supports the extension of the control of the Government of Lebanon over\nall Lebanese territory;\n2S/RES/1559 (2004)\n5. Declares its support for a free and fair electoral process in Lebanon’s\nupcoming presidential election conducted acco rding to Lebanese constitutional rules\ndevised without foreign interference or influence;\n6. Calls upon all parties concerned to cooperate fully and urgently with the\nSecurity Council for the full implementation of this and all relevant resolutionsconcerning the restoration of the territorial integrity, full sovereignty, and political\nindependence of Lebanon;\n7. Requests that the Secretary-General report to the Security Council within\nthirty days on the implementation by the parties of this resolution and decides to\nremain actively seized of the matter.",
  "articles": {
    "1": "Reaffirms its call for the strict respect of the sovereignty, territorial integrity, unity, and political independence of Lebanon under the sole and exclusiveauthority of the Government of Lebanon throughout Lebanon;",
    "2": "Calls upon all remaining foreign forces to withdraw from Lebanon;",
    "3": "Calls for the disbanding and disarmament of all Lebanese and non- Lebanese militias;",
    "4": "Supports the extension of the control of the Government of Lebanon over all Lebanese territory; 2S/RES/1559 (2004)",
    "5": "Declares its support for a free and fair electoral process in Lebanon’s upcoming presidential election conducted acco rding to Lebanese constitutional rules devised without foreign interference or influence;",
    "6": "Calls upon all parties concerned to cooperate fully and urgently with the Security Council for the full implementation of this and all relevant resolutionsconcerning the restoration of the territorial integrity, full sovereignty, and political independence of Lebanon;",
    "7": "Requests that the Secretary-General report to the Security Council within thirty days on the implementation by the parties of this resolution and decides to remain actively seized of the matter."
  },
  "article_count": 7,
  "cached_at": "2025-07-26 11:22:52"
}