{
  "resolution_number": "2591",
  "url": "https://undocs.org/en/S/RES/2591(2021)",
  "full_text": "United Nations S/RES/2591 (2021) \n Security Council Distr.: General \n30 August 2021 \n\n21-12018 (E) \n*2112018* \n\n Resolution 2591 (2021) \n\n Adopted by the Security Council at its 8845th meeting, on \n30 August 2021 \n\n The Security Council , \n Recalling all its previous resolutions on Lebanon, in particular resol utions 425 \n(1978) , 426 (1978) , 1559 (2004) , 1680 (2 006) , 1701 (2006) , 1773 (2007) , 1832 \n(2008) , 1884 (2009) , 1937 (2010) and 2004 (2011) , 2064 (2012) , 2115 (2013) , 2172 \n(2014) and 2236 (2015) , 2305 (2016) , 2373 (2017) , 2433 (2018) , 2485 (2019) and \n2539 (2020) as well as the statements of its President on t he situation in Lebanon and \nthe Press statements dated 19 December 2016, 27 March 2018, 9 August 2018, \n8 February 2019, \n Expressing its solidarity with Lebanon and its people in the aftermath of the \nexplosions which struck Beirut on 4 August 2020, causing a significant number of \ncasualties and wounding thousands of people, including some UNIFIL personnel, and \ncausing severe damages to commercial and residential infrastr uctures as well as to \nUNIFIL capacities, stressing the need for a swift, independent, imp artial, thorough \nand transparent investigation into the explosions by the Lebanese judicial system, and \nwelcoming the International Conference on Assistance and Suppor t to Lebanon and \nBeirut, organized on the 9 August 2020 by France and the United Nations and the \nfollow -up International Conferences organized by France and the United Nations on \n2 December 2020 and 4 August 2021, further calling the international communit y to \nreinforce its support to Lebanon and its people in that context, \n Strongly urging the Lebanese political leaders to form , without further delay \nand with a sense of urgency, a new Government which can respond to the needs and \naspirations of the Lebane se population and the current main challenges Lebanon is \nfacing, in particular the recons truction of Beirut, the COVID -19 pandemic, and the \nimplementation of reforms, which are absolutely necessary to overcome and recover \nfrom the current and unprecedented acute social, economic and humanitarian crises, \nexpressing grave concern about the obsta cles to the political process and \nimplementation of the necessary reforms, and calling on the Lebanese authorities to \ntake all necessary steps to ensure the conduct of elections in 2022 according to the \nplanned schedule, \n Stressing the urgent need for the Lebanese authorities to respond to the \naspirations of the Lebanese people by implementing much needed and meaningful \neconomic reforms, and notably the commitments made in the framework of the \nCEDRE conference as well as at the International Support Group f or Lebanon \nS/RES/2591 (2021) \n\n21-12018 2/9 \n meeting held in Paris on the 11 December 2019 and reiterating , on the basis of those \nnecessary reforms, support to Lebanon to help it exit the current crisi s and to address \nthe economic, security, humanitarian challenges, as well as the impact o f COVID -19 \nfacing the country, and called upon the international community, including \ninternational organizations, to do so, \n Commending UNIFIL for the preventive and responsive measures taken to fight \nthe COVID -19 pandemic and recalling resolution 2532 an d its request to the \nSecretary -General to instruct peace -keeping operations to provide support, within \ntheir mandates and capacities, to host country authorities in th eir efforts to contain \nthe pandemic, in particular to facilitate humanitarian access, inc luding to internally \ndisplaced persons and refugee camps and allow for medical evacuations, as well as \nits request to the Secretary -General and Member States to take a ll appropriate steps \nto protect the safety, security and health of all UN personnel in UN peace operations, \nwhile maintaining the continuity of operations, and to take further steps towards the \nprovision of training for peacekeeping personnel on issues rel ated to preventing the \nspread of COVID -19, \n Responding to the request of the Government o f Lebanon to extend the mandate \nof the United Nations Interim Force in Lebanon (UNIFIL) for a period of one year \nwithout amendment presented in a letter from the Leban ese Foreign Minister to the \nSecretary -General of 24 June 2021 and welcoming the letter fr om the Secretary -\nGeneral to its President of 4 August 2021 ( S/2021/707 ) recommending this extension, \n Reiterating its strong support for the territorial integrity, sovereignty and \npolitical independence of Lebanon, \n Reaffirming its commitment to the full i mplementation of all provisions of \nresolution 1701 (2006) , and aware of its responsibilities to help secure a permanent \nceasefire and a long -term solution as envisioned in the resolution, \n Expressing deep concern at the continued lack of progress made towa rds the \nestablishment of a permanent ceasefire and other key provisions of resolution 1701 \n(2006) fifteen years after its adoption, \n Calling upon all concerned parties to strengthen their efforts, including by \nexploring concrete solutions with the Special Coord inator of the Secretary -General \nand the UNIFIL Force Commander, to fully implement all provisions of resolution \n1701 (2006) without delay, \n Expressing deep concern at all violations, both by air and g round, in connection \nwith resolution 1701 (2006) as underlined by the Secretary -General in his reports, \nand recalling the importance of control of the Government of Lebanon over all \nLebanese territory , \n Underlining the risk that violations of the cessation of hostilities could lead to \na new conflict that n one of the parties or the region can afford, \n Urging all parties to make every effort to ensure that the cessation of hostilities \nis sustained, exerc ise maximum calm and restraint and refrain from any action or \nrhetoric that could jeopardize the cessation of hostilities or destabilize the region, \n Condemning the incidents of August -September 2019 and of the 14 April 2020 \nof 17 April 2020, and of 27 Jul y 2020 and of May 2021, 20 July 2021 and 4 –6 August \n2021 which occurred across the Blue Line, calling on the parties to resort to the \nTripartite Mechanism when such incidents occur, and further commending the liaison \nand prevention role played by UNIFIL al lowing for de -escalation, \n S/RES/2591 (2021) \n\n3/9 21-12018 \n Emphasizing to all parties the importance of full compliance with the \nprohibitio n on sales and supply of arms and related materiel established by resolution \n1701 (2006) , \n Recalling the utmost importance that all parties concerned respect the Blue Line \nin its entirety, noting with great and increasing concern that UNIFIL still has not been \nable to access all relevant locations north of the Blue Line related to the discovery of \ntunnels crossing the Blue Line which UNIFIL reported as a violation of resolution \n1701 (2006) , and urging the Lebanese authorities to urgently conclude all necess ary \ninvestigations on the matter, in line with resolution 1701 (2006) , \n Welcoming the continued progress in the marking of the Blue Line, and \nencouraging the parties to accelerate their efforts in coordination with UNIFIL, \nincluding thro ugh the tripartite mechanism, to continue working in the ongoing \nprocess to delineate and visibly mark the Blue Line in its entirety, as well as to move \nforward on the marking of its points of contention, as recommended by the Strategic \nReview, \n Condemning in the strongest t erms all attempts to threaten the security and \nstability of Lebanon, \n Reaffirming its determination to ensure that no such acts of intimidation prevent \nUNIFIL from implementing its mandate in accordance with Security Council \nresolution 1701 (2006) , recalli ng the necessity for all parties to ensure that UNIFIL \npersonnel are secure and their freedom of movement is fully respected and unimpeded \nand continues to respect the separate, sup porting mandate under which Observer \nGroup Lebanon operates, condemning in the strongest terms all attempts to restrict \nthe freedom of movement of UNIFIL’s personnel, all acts of harassment and \nintimidation and all attacks against peacekeepers, including t he attacks against \nUNIFIL forces on 4 August 2018 near the town of Majdal Z un, on 25 May 2020 in \nthe town of Belida Southern Lebanon, and on the 10 February 2020, in Brashit, \n Urging the Lebanese authorities to swiftly provide UNIFIL with further updates \nand finalise investigations on these matters, and welcoming the verdicts of \n21 December 2020 and 24 March 2021 by Lebanon’s Military Court sentencing the \nperpetrators of attacks against UNIFIL peacekeepers in 1980 and in July 2011, \n Reiterating the importan ce of the extension of the control of the Government of \nLebanon over all Le banese territory in accordance with the provisions of resolution \n1559 (2004) and resolution 1680 (2006) , and of the relevant provisions of the Taif \nAccords, \n Encouraging all Lebanese parties to resume discussions towards a consensus on \na National Defence Strategy as set out by the President of Lebanon and the Lebanese \nDefen se Minister on 29 April 2019, in accordance with relevant Security Council \nresolutions a nd the Taif Agreement, \n Welcoming progress made to implement Lebanon’s first National Action Plan \non Women, Peace and Security, and encouraging the Government of Lebano n to \ncontinue to fully implement it, with the support of UNIFIL and women’s civil societ y \ngroups, as soon as possible and to ensure the full, equal, effective, and meaningful \nparticipation of women at all levels of decision -making in all efforts for the \nmaintenance and promotion of peace and security, welcoming the work of UNIFIL in \nthis rega rd, \n Recalling the importance of ensuring the protection of children and taking \nappropriate measures in this regard, in line with relevant Security Council resolutions \non Children and armed conflict, \nS/RES/2591 (2021) \n\n21-12018 4/9 \n Recalling the relevant principles contained in the Conv ention on the Safety of \nUnited Nations and Associated Personnel, \n Commending the active role and dedication of the personnel of UNIFIL and \nexpressing its strong appreci ation to Member States that contribute to UNIFIL and \nunderlining the necessity that UNIF IL has at its disposal all necessary means and \nequipment to carry out its mandate, \n Recognizing that UNIFIL has successfully implemented its mandate since 2006 \nand has allowed for maintaining peace and security since then, \n Recalling the request from the G overnment of Lebanon to deploy an \ninternational force to assist it to exercise its authority throughout the territory, and \nreaffirming UNIFIL’s authority to take all ne cessary action in areas of operations of \nits forces and as it deems within its capabilit ies, to ensure that its area of operations \nis not utilized for hostile activities of any kind and to resist attempts by forceful means \nto prevent it from discharging it s mandate, \n Welcoming the crucial role played by the Lebanese Armed Forces and security \nforces, as the only legitimate armed forces in Lebanon, in extending and sustaining \nthe authority of the Government of Lebanon, in particular in southern Lebanon, and \nresponding to other security challenges, including the threat of terrorism, and the \nstron g international commitment to support the Lebanese Armed Forces, which has \nhelped strengthen the capability of the Lebanese Armed Forces to provide security \nfor Lebanon , strongly urging further and increased international support to the \nLebanese Armed Forc es in the context of the current economic crisis, and further \nnoting the relevance of this increased capacity in relation to their efforts to coordinate \nwith UNIFIL in the implementation of the UNIFIL mandate, and calling upon \nMember States to urgently ass ist the Lebanese Armed Forces as needed to enable it \nto perform its duties in line with resolution 1701 (2006) , \n Expressing concern about the strong negative impact of the current social, \neconomic and humanitarian crises on the capacities of the Lebanese A rmed Forces \nand security forces and welcoming the International Conference chaired by France \nand Italy in suppor t of the Lebanese Armed Forces on 17 June 2021 with the support \nof the Office of the United Nations Special Coordinator for Lebanon, \n Recalling resolution 2378 (2017) and its request of the Secretary -General to \nensure that data related to the effectiveness of peacekeeping operations, including \npeacekeeping performance data, is used to improve analytics and the evaluation of \nmission operations, bas ed on clear and well identified benchmarks, further recalling \nresolution 2436 (2018) and its request of the Secretary -General to ensure that \ndecisions to recognize and incentivize outstanding performance and decisions \nregarding deployment, remediation, tra ining, withholding of financial reimbursement, \nand repatriation of uniformed or dismissal of civilian personnel, are predicated on \nobjective performance data, and emphasizing the need to regularly evaluate UNIFIL’s \nperformance such that the mission retains the skills and flexibility needed to \neffectively carry out its mandate, \n Also recalling resolution 2242 (2015) and its request of the Secretary -General \nto initiate, in collaboration with Member State s, a revised strategy, within existing \nresources, to dou ble the number of women in military and police contingents of UN \npeacekeeping operations, \n Emphasizing the need to regularly review all peacekeeping operations to ensure \nefficiency and effectiveness, including reviews of UNIFIL when appropriate, taking \ninto account developments on the ground, \n S/RES/2591 (2021) \n\n5/9 21-12018 \n Bearing in mind the strategic priorities and recommendations identified by the \nSecretary -General in his letter of 12 March 2012 ( S/2012/151 ) as a result of the \nStrategic Review of UNIFIL, taking note of his letter of 8 March 2017 ( S/2017/202 ) \nas a result of the most recent Strategic Review of UNIFIL, and expressing the need \nfor a follow -up and update, \n Welcoming the Secretary -General’s 1 June 2020 Assessment of UNIFIL and \nnoting with appreciation the recommendations to further increase the efficiency and \neffectiveness of UNIFIL, \n Determining that the situation in Leb anon continues to constitute a threat to \ninternational peace and security, \n 1. Decides to extend the present mandate of UNIFIL until 31 August 2022; \n 2. Com mends the positive role of UNIFIL, whose deployment together with \nthe Lebanese Armed Forces has help ed to establish a new strategic environment in \nsouthern Lebanon, welcomes the expansion of coordinated activities between UNIFIL \nand the Lebanese Armed Forc es, and calls for further enhancement of this cooperation \nwithout prejudice to UNIFIL’s mandate; \n 3. Affirms its strong continuing commitment to the existing UNIFIL mandate \nand calls for the full implementation of resolution 1701 (2006) ; \n 4. Reiterates its call for Israel and Lebanon to support a pe rmanent ceasefire \nand a long -term solution based on the principles and elements set out in paragraph 8 \nof resolution 1701 (2006) ; \n 5. Strongly reaffirms the necessity of an effective and durable deplo yment of \nthe Lebanese Armed Forces in southern Lebanon and the territorial waters of Lebanon \nat an accelerated pace to fully implement the provisions of resolution 1701 (2006) \nand requests the Secreta ry-General to include in his future reports assessments of \nprogress made in this regard and calls for renewed engagement of UNIFIL and the \nLebanese Armed Forces in the Strategic Dialogue, which aims at carrying out analysis \nof ground forces and maritime as sets and setting a series of benchmarks reflecting the \ncorrelation b etween the capacities and responsibilities of UNIFIL vis -à-vis those of \nthe Lebanese Armed Forces; \n 6. Recalls its request for precise timelines to be jointly and promptly \nelaborated by th e Lebanese Armed Forces and the Secretary -General, for the \ndeploymen ts in paragraph 5, with a view to identifying Lebanese Armed Forces \nprogress in implementing tasks mandated in resolution 1701 (2006) ; \n 7. Reiterates its call for the Government of Lebanon to present a plan to \nincrease its naval capabilities as soon as pos sible, including with appropriate support \nfrom the international community, with the goal of ultimately decreasing UNIFIL’s \nMaritime Taskforce and transitioning its responsibilities to the Lebanese Armed \nForces (LAF), in close conjunction with the effectiv e build -up of the capabilities of \nthe Lebanese Navy, takes note in that regard of the letter dated 12 March 2019 to the \nUnited Natio ns outlining the commitment of the Government of Lebanon and \nwelcomes its ongoing efforts towards that goal; takes note of the impact of the Beirut \nexplosions on 4 August 2020 on the operations of the LAF; \n 8. Welcomes the report of the Secretary -General o n the assessment of the \ncontinued relevance of UNIFIL’s resources and options for improving the efficiency \nand effectiveness between UNIFIL and UNSCOL, taking into consideration the troop \nceiling and the civilian component of UNIFIL ( S/2020/473 ) and requests the \nSecretary -General to continue the implementation of his detailed plan, with timelines \nand specific modalities, in ful l and close consultation with the parties, including \nLebanon, the troop -contributi ng countries and the Members of the Security Council, \nS/RES/2591 (2021) \n\n21-12018 6/9 \n to implement recommendations, as appropriate, and further requests him to \nperiodically update the Security Council on th is process; \n 9. Reiterates its encouragement of the intention of the Government of \nLebanon to deploy a model regiment and an offshore patrol vessel in UNIFIL’s area \nof operations to advance the implementation of resolution 1701 (2006) and the \nauthority of the Lebanese State, recall s in this regard the joint statement issued at the \nend of the 15 March 2018 Rome Conference, in particular Lebanon’s concept for a \nnew Model Regiment proposed in the context of the ongoing Strategic Dialogue \nbetween the LAF and UN IFIL, notes Lebanon’s prop osed timeline for the deployment \nof the Model Regiment, and calls on the Lebanese Armed Forces and UNIFIL to \nstrengthen their coordinated actions; \n 10. Strongly urges further and increased international support for the Lebanese \nArmed Forces and all state s ecurity institutions, which are the only legitimate armed \nforces of Lebanon, in response to the capabilities development plan of the Lebanese \nArmed Forces, as well as in the framework of the International Support Group for \nLebanon , through additional and e xpedited assistance in areas where the Lebanese \nArmed Forces are most critically in need of support, including daily logistical needs \nand maintenance, counter -terrorism, border protection and naval capacity; \n 11. Further requests UNIFIL, in line with resol ution 1701, to take temporary \nand special measures, that should not be considered as a precedent in the future, to \nsupport and assist the Lebanese Armed Forces with the provision of relevant \nadditional non -lethal material (fuel, f ood and medicine) and logi stical support for a \nlimited period of 6 months, within the existing resources and without implications to \nthe increase of the budget level, in the framework of the LAF -UNIFIL joint activities \nand in compliance with the United Nat ions Human Rights Due Dili gence Policy, and \nwithout prejudice to the mandate and its implementation, the concept of operations \nand rules of engagement of UNIFIL, while fully respecting Lebanese sovereignty and \nat the request of the Lebanese authorities, an d that such support be sub ject to \nappropriate and immediate oversight and scrutiny; \n 12. Condemns all violations of the Blue Line, both by air and ground, and \nstrongly calls upon all parties to respect the cessation of hostilities, to prevent any \nviolation of the Blue Line and to r espect it in its entirety, and to cooperate fully with \nthe United Nations and UNIFIL; \n 13. Welcomes the constructive role played by the Tripartite Mechanism in \nfacilitating coordination and in de -escalating tensions, and recognize s the mission \nleadership’s active efforts, which has helped to further stabilize the situation along \nthe Blue Line and build trust between the parties, expresses in this regard strong \nsupport for the continued efforts of UNIFIL to engage with both parties to facilitate \nliaison, coo rdination, and practical arrangements on the ground and to continue to \nensure that the Tripartite Mechanism enables the parties to discuss a wider range of \nissues, and encourages UNIFIL, in close coordination with the parties, to implement \nmeasures to furt her reinforce the capacities of the Tripartite mechanism, including the \ncreation of additional ad hoc sub -committees, as recommended in the assessment \nreport of the Secretary -General, urges the parties to make a systematic, constr uctive \nand expanded use of the Tripartite mechanism, including the sub -committee on the \nmarking of the Blue Line and additional ad hoc sub -committees; \n 14. Stresses the need to foster enhanced cooperation between UNIFIL and the \nOffice of the United Nations Special Coordinator for L ebanon (UNSCOL), with the \ngoal of improving the effectiveness and efficiency of the missions, welcomes in this \nregard the improvements accomplished by the United Nations in terms of efficiencies \nand effectiveness between UNIFIL an d UNSCOL and encourages the Secretary -\nGeneral to further these efforts; \n S/RES/2591 (2021) \n\n7/9 21-12018 \n 15. Urges all parties to abide scrupulously by their obligation to respect the \nsafety of UNIFIL and other United Nations personnel, calls on them to take all \nappropriate measures to enhance the safety and secu rity of United Nations personnel \nand equipment , and reiterates its call for closer cooperation between UNIFIL and the \nLebanese Armed Forces in particular regarding coordinated and adjacent patrols, \nwelcomes the commitment of the Lebanese authorities to pro tect UNIFIL movements \nand reiterates its call for the rapid finalization of the investigation launched by \nLebanon regarding all attacks against UNIFIL and its personnel, in particular the \nincidents of 4 August 2018, and 10 February 2020, in order to swiftl y bring to justice \nthe perpetrators of these a ttacks; and requests the Secretary -General to report to the \nCouncil, within a reasonable timeframe, when such incidents occur as well as, when \nappropriate, on the follow -up of the related pending investigations ; \n 16. Urges all parties to ensure that the fr eedom of movement of UNIFIL in all \nits operations and UNIFIL’s access to the Blue Line in all its parts is fully respected \nand unimpeded, in conformity with its mandate and its rules of engagement, including \nby avoiding any course of action which endangers United Nations personnel, \ncondemns in the strongest terms all attempts to restrict the freedom of movement of \nUNIFIL’s personnel and all attacks on UNIFIL personnel and equipment as well as \nacts of harassment and intimidation of UNIFIL personnel; calls on the Government \nof Lebanon to facilitate UNIFIL’s prompt and full access to sites requested by UNIFIL \nfor the purpose of swift investigation, including all relevant locations north of the \nBlue Line related to t he discovery of tunnels crossing the Blue Line which UNIFIL \nreported as a violation of resolution 1701 (2006) , in line with resolution 1701, while \nrespecting the Lebanese Sovereignty; \n 17. Requests the Secretary -General to continue to take all appropriate \nmeasures to review and enhance the safety and security of peacekeeping personnel of \nUNIFIL, in line with resolution 2518 (2020) and other releva nt Security Council \nresolutions; \n 18. Urges all parties to cooperate fully with the Security Council and the \nSecretary -General to make tangible progress towar ds a permanent ceasefire and a \nlong -term solution as envisioned in resolution 1701 (2006) and on all outstanding \nissues in the implementation of Security Council resolutions 1701 (2006) , 1680 \n(2006) and 1559 (2004) , and other relevant Security Council reso lutions; \n 19. Urges the Government of Israel to expedite the withdrawal of its army \nfrom northern Ghajar without further delay in coordination with UNIFIL, which has \nactively engaged Israel and Lebanon to facilitate such a withdrawal; \n 20. Reaffirms its ca ll on all States to fully support and respect the establishment \nbetween the Blue Line and the Litani River of an area free of any armed personnel, \nassets and weapons other than those of the Government of Lebanon and UNIFIL; \n 21. Recalls paragraph 15 of res olution 1701 (2006) according to which all \nStates shall take the necessary measures to prevent, by their nationals or from their \nterritories or using flag vessels or aircraft, the sale or supply of arms and related \nmateriel to any entity or individual in L ebanon other than those authorized by the \nGovernment of Lebanon or UNIFIL; \n 22. Acting in support of a request from the Government of Lebanon to deploy \nan international force to assist it to exercise its authority throughout the territory, \nrecalls its auth orization to UNIFIL to take all necessary action in areas of deployment \nof its forces and as it deems within its capabilities, to ensure that its area of operations \nis not utilized for hostile activities of any kind, to resist attempts by forceful means \nto prevent it from discharging its duties under the mandate of the Security Council, \nand to protect United Nations personnel, facilities, installations and equipment, \nS/RES/2591 (2021) \n\n21-12018 8/9 \n ensure the security and freedom of movement of United Nations personnel, \nhumanitarian worke rs and, without prejudice to the responsibility of the Government \nof Leban on, to protect civilians under imminent threat of physical violence; \n 23. Commends UNIFIL’s operational changes in line with resolution 2373 \n(2017) and resolution 2433 (2018) and reiterates its request that the Secretary -\nGeneral look at ways to enhance UNIFIL’s efforts as regards paragraph 12 of \nresolution 1701 (2006) and paragraph 14 of this resolution, including ways to increase \nUNIFIL’s visible presence, including through patrols a nd inspections, within its \nexisting mandate and capabilities; \n 24. Recalls the decision that UNIFIL shall assist the government of Lebanon, \nat its request, as set out in paragraph 14 of resolution 1701 (2006) and within its \ncapabilities, to implement resol ution 1701 (2006) ; \n 25. Welcomes the efforts being undertaken by UNIFIL to implement the \nSecretary -General’s zero -tolerance policy on sexual exploitation and abuse and to \nensure full compliance of its personnel with the United Nations code of conduct, \nrequ ests the Secretary -General to continue to take nec essary measures to ensure full \ncompliance of all personnel, civilian and uniformed, in UNIFIL with the United \nNations zero -tolerance policy on sexual exploitation and abuse and to keep the \nSecurity Council fully informed about the Mission’s progress in thi s regard, stresses \nthe need to prevent such exploitation and abuse and to improve how allegations are \naddressed in line with its resolution 2272 (2016) , and urges troop -contributing \ncountries to conti nue ta king appropriate preventative action, including vetting of all \npersonnel, pre -deployment and in -mission awareness training, and to take appropriate \nsteps to ensure full accountability in cases of such conduct involving their personnel, \nincluding thro ugh ti mely investigations of allegations, as appropriate, and to hold \nperpetrators accountable and repatriate units when there is credible evidence of \nwidespread or systemic sexual exploitation and abuse by those units; \n 26. Requests UNIFIL to take fully i nto ac count gender considerations as a \ncross -cutting issue throughout its mandate and to assist the Lebanese authorities in \nensuring the full, equal, effective and meaningful participation, involvement and \nrepresentation of women at all levels of decision -making in all efforts for the \nmaintenance and promotion of peace and security, including in the security sector, as \nwell as to support the implementation of the action plan on Women and Peace and \nSecurity, including to prevent and respond to sexual and gen der ba sed violence, \nfurther requests enhanced reporting by UNIFIL to the Security Council on this issue; \n 27. Requests the Secretary -General and the troop -contributing countries to \nseek to increase the number of women in UNIFIL, as well as to ensure the fu ll, \neffective and meaningful participation of women in all aspects of operations and to \nimplement relevant provisions of resolution 2538 (2020) in this regard; \n 28. Requests the Secretary -General, in the planning and conduct of UNIFIL’s \noperations, to implement peacekeeping performance requirements under resolutions \n2378 (2017) and 2436 (2018) ; \n 29. Requests the Secretary -General to continue to report to the Council on the \nimplementation of resolution 1701 (2006) , every four months, or at any time as he \ndeems app ropriate, and to include i n his reporting a prompt and detailed breakdown \nof all resolution 1701 (2006) violations, clarifications by the parties and updates on \nall pending investigations into such violations of resolution 170 1, prompt and detailed \nreports on violations of the sovereignty of Lebanon, prompt and detailed reports on \nthe restrictions to UNIFIL’s freedom of movement, an enhanced annex on the \nimplementation on the arms embargo, reports on specific areas where UNIFIL does \nnot access and on the re asons behind these restrictions, potential risks to the cessation \n S/RES/2591 (2021) \n\n9/9 21-12018 \n of hostilities and UNIFIL’s response as well as reports on progress made as regards \nthe detailed plan on the implementation of the 1 June assessment report as s et out in \nparagraph 8 of the p resent resolution and on additional identified efficiencies to most \nappropriately fulfil its mandated tasks; requests the Secretary -General to continue to \nprovide concrete and detailed information on the aforementioned issues to the \nCouncil, in line with c hanges to enhance reporting since the adoption of resolution \n2373 (2017) , 2433 (2018) , 2485 (2019) and 2539 (2020) ; \n 30. Stresses the importance of, and the need to achieve, a comprehensive, just \nand lasting peace in the Middle East, based on all its relev ant resolutions including \nits resolutions 242 (1967) of 22 November 1967, 338 (1973) of 22 October 1973, \n1515 (2003) of 19 November 2003 and 1850 (2008) of 16 December 2008; \n 31. Decides to remain actively seized of the matter.",
  "articles": {
    "1": "Decides to extend the present mandate of UNIFIL until 31 August 2022;",
    "2": "Com mends the positive role of UNIFIL, whose deployment together with the Lebanese Armed Forces has help ed to establish a new strategic environment in southern Lebanon, welcomes the expansion of coordinated activities between UNIFIL and the Lebanese Armed Forc es, and calls for further enhancement of this cooperation without prejudice to UNIFIL’s mandate;",
    "3": "Affirms its strong continuing commitment to the existing UNIFIL mandate and calls for the full implementation of resolution 1701 (2006) ;",
    "4": "Reiterates its call for Israel and Lebanon to support a pe rmanent ceasefire and a long -term solution based on the principles and elements set out in paragraph 8 of resolution 1701 (2006) ;",
    "5": "Strongly reaffirms the necessity of an effective and durable deplo yment of the Lebanese Armed Forces in southern Lebanon and the territorial waters of Lebanon at an accelerated pace to fully implement the provisions of resolution 1701 (2006) and requests the Secreta ry-General to include in his future reports assessments of progress made in this regard and calls for renewed engagement of UNIFIL and the Lebanese Armed Forces in the Strategic Dialogue, which aims at carrying out analysis of ground forces and maritime as sets and setting a series of benchmarks reflecting the correlation b etween the capacities and responsibilities of UNIFIL vis -à-vis those of the Lebanese Armed Forces;",
    "6": "Recalls its request for precise timelines to be jointly and promptly elaborated by th e Lebanese Armed Forces and the Secretary -General, for the deploymen ts in paragraph 5, with a view to identifying Lebanese Armed Forces progress in implementing tasks mandated in resolution 1701 (2006) ;",
    "7": "Reiterates its call for the Government of Lebanon to present a plan to increase its naval capabilities as soon as pos sible, including with appropriate support from the international community, with the goal of ultimately decreasing UNIFIL’s Maritime Taskforce and transitioning its responsibilities to the Lebanese Armed Forces (LAF), in close conjunction with the effectiv e build -up of the capabilities of the Lebanese Navy, takes note in that regard of the letter dated 12 March 2019 to the United Natio ns outlining the commitment of the Government of Lebanon and welcomes its ongoing efforts towards that goal; takes note of the impact of the Beirut explosions on 4 August 2020 on the operations of the LAF;",
    "8": "Welcomes the report of the Secretary -General o n the assessment of the continued relevance of UNIFIL’s resources and options for improving the efficiency and effectiveness between UNIFIL and UNSCOL, taking into consideration the troop ceiling and the civilian component of UNIFIL ( S/2020/473 ) and requests the Secretary -General to continue the implementation of his detailed plan, with timelines and specific modalities, in ful l and close consultation with the parties, including Lebanon, the troop -contributi ng countries and the Members of the Security Council, S/RES/2591 (2021) 21-12018 6/9 to implement recommendations, as appropriate, and further requests him to periodically update the Security Council on th is process;",
    "9": "Reiterates its encouragement of the intention of the Government of Lebanon to deploy a model regiment and an offshore patrol vessel in UNIFIL’s area of operations to advance the implementation of resolution 1701 (2006) and the authority of the Lebanese State, recall s in this regard the joint statement issued at the end of the 15 March 2018 Rome Conference, in particular Lebanon’s concept for a new Model Regiment proposed in the context of the ongoing Strategic Dialogue between the LAF and UN IFIL, notes Lebanon’s prop osed timeline for the deployment of the Model Regiment, and calls on the Lebanese Armed Forces and UNIFIL to strengthen their coordinated actions;",
    "10": "Strongly urges further and increased international support for the Lebanese Armed Forces and all state s ecurity institutions, which are the only legitimate armed forces of Lebanon, in response to the capabilities development plan of the Lebanese Armed Forces, as well as in the framework of the International Support Group for Lebanon , through additional and e xpedited assistance in areas where the Lebanese Armed Forces are most critically in need of support, including daily logistical needs and maintenance, counter -terrorism, border protection and naval capacity;",
    "11": "Further requests UNIFIL, in line with resol ution 1701, to take temporary and special measures, that should not be considered as a precedent in the future, to support and assist the Lebanese Armed Forces with the provision of relevant additional non -lethal material (fuel, f ood and medicine) and logi stical support for a limited period of 6 months, within the existing resources and without implications to the increase of the budget level, in the framework of the LAF -UNIFIL joint activities and in compliance with the United Nat ions Human Rights Due Dili gence Policy, and without prejudice to the mandate and its implementation, the concept of operations and rules of engagement of UNIFIL, while fully respecting Lebanese sovereignty and at the request of the Lebanese authorities, an d that such support be sub ject to appropriate and immediate oversight and scrutiny;",
    "12": "Condemns all violations of the Blue Line, both by air and ground, and strongly calls upon all parties to respect the cessation of hostilities, to prevent any violation of the Blue Line and to r espect it in its entirety, and to cooperate fully with the United Nations and UNIFIL;",
    "13": "Welcomes the constructive role played by the Tripartite Mechanism in facilitating coordination and in de -escalating tensions, and recognize s the mission leadership’s active efforts, which has helped to further stabilize the situation along the Blue Line and build trust between the parties, expresses in this regard strong support for the continued efforts of UNIFIL to engage with both parties to facilitate liaison, coo rdination, and practical arrangements on the ground and to continue to ensure that the Tripartite Mechanism enables the parties to discuss a wider range of issues, and encourages UNIFIL, in close coordination with the parties, to implement measures to furt her reinforce the capacities of the Tripartite mechanism, including the creation of additional ad hoc sub -committees, as recommended in the assessment report of the Secretary -General, urges the parties to make a systematic, constr uctive and expanded use of the Tripartite mechanism, including the sub -committee on the marking of the Blue Line and additional ad hoc sub -committees;",
    "14": "Stresses the need to foster enhanced cooperation between UNIFIL and the Office of the United Nations Special Coordinator for L ebanon (UNSCOL), with the goal of improving the effectiveness and efficiency of the missions, welcomes in this regard the improvements accomplished by the United Nations in terms of efficiencies and effectiveness between UNIFIL an d UNSCOL and encourages the Secretary - General to further these efforts; S/RES/2591 (2021) 7/9 21-12018",
    "15": "Urges all parties to abide scrupulously by their obligation to respect the safety of UNIFIL and other United Nations personnel, calls on them to take all appropriate measures to enhance the safety and secu rity of United Nations personnel and equipment , and reiterates its call for closer cooperation between UNIFIL and the Lebanese Armed Forces in particular regarding coordinated and adjacent patrols, welcomes the commitment of the Lebanese authorities to pro tect UNIFIL movements and reiterates its call for the rapid finalization of the investigation launched by Lebanon regarding all attacks against UNIFIL and its personnel, in particular the incidents of 4 August 2018, and 10 February 2020, in order to swiftl y bring to justice the perpetrators of these a ttacks; and requests the Secretary -General to report to the Council, within a reasonable timeframe, when such incidents occur as well as, when appropriate, on the follow -up of the related pending investigations ;",
    "16": "Urges all parties to ensure that the fr eedom of movement of UNIFIL in all its operations and UNIFIL’s access to the Blue Line in all its parts is fully respected and unimpeded, in conformity with its mandate and its rules of engagement, including by avoiding any course of action which endangers United Nations personnel, condemns in the strongest terms all attempts to restrict the freedom of movement of UNIFIL’s personnel and all attacks on UNIFIL personnel and equipment as well as acts of harassment and intimidation of UNIFIL personnel; calls on the Government of Lebanon to facilitate UNIFIL’s prompt and full access to sites requested by UNIFIL for the purpose of swift investigation, including all relevant locations north of the Blue Line related to t he discovery of tunnels crossing the Blue Line which UNIFIL reported as a violation of resolution 1701 (2006) , in line with resolution 1701, while respecting the Lebanese Sovereignty;",
    "17": "Requests the Secretary -General to continue to take all appropriate measures to review and enhance the safety and security of peacekeeping personnel of UNIFIL, in line with resolution 2518 (2020) and other releva nt Security Council resolutions;",
    "18": "Urges all parties to cooperate fully with the Security Council and the Secretary -General to make tangible progress towar ds a permanent ceasefire and a long -term solution as envisioned in resolution 1701 (2006) and on all outstanding issues in the implementation of Security Council resolutions 1701 (2006) , 1680 (2006) and 1559 (2004) , and other relevant Security Council reso lutions;",
    "19": "Urges the Government of Israel to expedite the withdrawal of its army from northern Ghajar without further delay in coordination with UNIFIL, which has actively engaged Israel and Lebanon to facilitate such a withdrawal;",
    "20": "Reaffirms its ca ll on all States to fully support and respect the establishment between the Blue Line and the Litani River of an area free of any armed personnel, assets and weapons other than those of the Government of Lebanon and UNIFIL;",
    "21": "Recalls paragraph 15 of res olution 1701 (2006) according to which all States shall take the necessary measures to prevent, by their nationals or from their territories or using flag vessels or aircraft, the sale or supply of arms and related materiel to any entity or individual in L ebanon other than those authorized by the Government of Lebanon or UNIFIL;",
    "22": "Acting in support of a request from the Government of Lebanon to deploy an international force to assist it to exercise its authority throughout the territory, recalls its auth orization to UNIFIL to take all necessary action in areas of deployment of its forces and as it deems within its capabilities, to ensure that its area of operations is not utilized for hostile activities of any kind, to resist attempts by forceful means to prevent it from discharging its duties under the mandate of the Security Council, and to protect United Nations personnel, facilities, installations and equipment, S/RES/2591 (2021) 21-12018 8/9 ensure the security and freedom of movement of United Nations personnel, humanitarian worke rs and, without prejudice to the responsibility of the Government of Leban on, to protect civilians under imminent threat of physical violence;",
    "23": "Commends UNIFIL’s operational changes in line with resolution 2373 (2017) and resolution 2433 (2018) and reiterates its request that the Secretary - General look at ways to enhance UNIFIL’s efforts as regards paragraph 12 of resolution 1701 (2006) and paragraph 14 of this resolution, including ways to increase UNIFIL’s visible presence, including through patrols a nd inspections, within its existing mandate and capabilities;",
    "24": "Recalls the decision that UNIFIL shall assist the government of Lebanon, at its request, as set out in paragraph 14 of resolution 1701 (2006) and within its capabilities, to implement resol ution 1701 (2006) ;",
    "25": "Welcomes the efforts being undertaken by UNIFIL to implement the Secretary -General’s zero -tolerance policy on sexual exploitation and abuse and to ensure full compliance of its personnel with the United Nations code of conduct, requ ests the Secretary -General to continue to take nec essary measures to ensure full compliance of all personnel, civilian and uniformed, in UNIFIL with the United Nations zero -tolerance policy on sexual exploitation and abuse and to keep the Security Council fully informed about the Mission’s progress in thi s regard, stresses the need to prevent such exploitation and abuse and to improve how allegations are addressed in line with its resolution 2272 (2016) , and urges troop -contributing countries to conti nue ta king appropriate preventative action, including vetting of all personnel, pre -deployment and in -mission awareness training, and to take appropriate steps to ensure full accountability in cases of such conduct involving their personnel, including thro ugh ti mely investigations of allegations, as appropriate, and to hold perpetrators accountable and repatriate units when there is credible evidence of widespread or systemic sexual exploitation and abuse by those units;",
    "26": "Requests UNIFIL to take fully i nto ac count gender considerations as a cross -cutting issue throughout its mandate and to assist the Lebanese authorities in ensuring the full, equal, effective and meaningful participation, involvement and representation of women at all levels of decision -making in all efforts for the maintenance and promotion of peace and security, including in the security sector, as well as to support the implementation of the action plan on Women and Peace and Security, including to prevent and respond to sexual and gen der ba sed violence, further requests enhanced reporting by UNIFIL to the Security Council on this issue;",
    "27": "Requests the Secretary -General and the troop -contributing countries to seek to increase the number of women in UNIFIL, as well as to ensure the fu ll, effective and meaningful participation of women in all aspects of operations and to implement relevant provisions of resolution 2538 (2020) in this regard;",
    "28": "Requests the Secretary -General, in the planning and conduct of UNIFIL’s operations, to implement peacekeeping performance requirements under resolutions 2378 (2017) and 2436 (2018) ;",
    "29": "Requests the Secretary -General to continue to report to the Council on the implementation of resolution 1701 (2006) , every four months, or at any time as he deems app ropriate, and to include i n his reporting a prompt and detailed breakdown of all resolution 1701 (2006) violations, clarifications by the parties and updates on all pending investigations into such violations of resolution 170 1, prompt and detailed reports on violations of the sovereignty of Lebanon, prompt and detailed reports on the restrictions to UNIFIL’s freedom of movement, an enhanced annex on the implementation on the arms embargo, reports on specific areas where UNIFIL does not access and on the re asons behind these restrictions, potential risks to the cessation S/RES/2591 (2021) 9/9 21-12018 of hostilities and UNIFIL’s response as well as reports on progress made as regards the detailed plan on the implementation of the 1 June assessment report as s et out in paragraph 8 of the p resent resolution and on additional identified efficiencies to most appropriately fulfil its mandated tasks; requests the Secretary -General to continue to provide concrete and detailed information on the aforementioned issues to the Council, in line with c hanges to enhance reporting since the adoption of resolution 2373 (2017) , 2433 (2018) , 2485 (2019) and 2539 (2020) ;",
    "30": "Stresses the importance of, and the need to achieve, a comprehensive, just and lasting peace in the Middle East, based on all its relev ant resolutions including its resolutions 242 (1967) of 22 November 1967, 338 (1973) of 22 October 1973, 1515 (2003) of 19 November 2003 and 1850 (2008) of 16 December 2008;",
    "31": "Decides to remain actively seized of the matter."
  },
  "article_count": 31,
  "cached_at": "2025-07-26 21:48:40"
}