{
  "resolution_number": "1680",
  "url": "https://undocs.org/en/S/RES/1680(2006)",
  "full_text": "United Nations S/RES/1680 (2006)\n Security Council Distr.: General\n17 May 2006\n06-35177 (E)\n*0635177*Resolution 1680 (2006)\nAdopted by the Security Co uncil at its 5440th meeting, on\n17 May 2006\nThe Security Council ,\nRecalling all its previous resolutions on Lebanon, in particular resolutions\n1559 (2004), 425 and 426 (1978), resolution 520 (1982) and resolution 1655 (2006),as well as the statements of its Presiden t on the situation in Lebanon, in particular\nthe statements of 18 June 2000 (S/PRST/2000/21), of 19 October 2004(S/PRST/2004/36), of 4 May 2005 (S/PRST/2005/17) and of 23 January 2006(S/PRST/2006/3),\nReiterating its strong support for the territorial integrity, sovereignty and\npolitical independence of Lebanon within its internationally recognized borders,\nNoting positively that further significant progress has been made towards\nimplementing in full all provisions of resolution 1559 (2004), in particular throughthe Lebanese national dialogue, but noting al so with regret that other provisions of\nresolution 1559 have not yet been fully implemented, namely the disbanding anddisarming of Lebanese and non-Lebanese militias, the extension of the control ofthe Government of Lebanon over all its territory, the strict respect of the\nsovereignty, territorial integrity, unity and political independen ce of Lebanon, and\nfree and fair presidential elections conducted according to the Lebanese\nconstitutional rules, without foreign interference and influence,\nNoting with concern the conclusion of the Secretary-General’s report\n(S/2006/248) that there had been movements of arms into Lebanese territory formilitias over the last six months,\nExpressing full support for the Lebanese National Dialogue and commending\nall Lebanese parties for its conduct and for the consensus reached in this context onimportant matters,\nHaving heard the Prime Minister of Lebanon’s address to the Security Council\non 21 April 2006 (S/PV .5417),\n1. Welcomes the third semi-annual report of the Secretary General to the\nSecurity Council of 18 April 2006 on the implementation of resolution 1559 (2004)(S/2006/248);\n2S/RES/1680 (2006)\n2. Reiterates its call for the full implementation of all requirements of\nresolution 1559 (2004);\n3. Reiterates also its call on all concerned States and parties as mentioned\nin the report, to cooperat e fully with the Government of Lebanon, the Security\nCouncil and the Secretary-General to achieve this goal;\n4. Strongly encourages the Government of Syria to respond positively to the\nrequest made by the Government of Lebanon, in line with the agreements of theLebanese national dialogue, to delineate their common border, especially in thoseareas where the border is uncertain or disputed and to establish full diplomaticrelations and representation, noting th at such measures would constitute a\nsignificant step towards asserting Lebanon’s sovereignty, territorial integrity andpolitical independence and improving the re lations between the two countries, thus\ncontributing positively to the stability in the region, and urges both parties to makeefforts through further bilateral dialogue to this end, bearing in mind that theestablishment of diplomatic relations between States, and of permanent diplomaticmissions, takes place by mutual consent;\n5.\nCommends the Government of Lebanon for undertaking measures against\nmovements of arms into Lebanese territory and calls on the Government of Syria totake similar measures;\n6.\nWelcomes the decision of the Lebanese national dialogue to disarm\nPalestinian militias outside refugee camps within six months, supports itsimplementation and calls for further efforts to disband and disarm all Lebanese andnon-Lebanese militias and to restore fully the Lebanese Government’s control over\nall Lebanese territory;\n7.\nReiterates its support to the Secretary-General and his Special envoy in\ntheir efforts and dedication to facilitate and assist in the implementation of all\nprovisions of resolution 1559 (2004);\n8. Decides to remain seized of the matter.",
  "articles": {
    "1": "Welcomes the third semi-annual report of the Secretary General to the Security Council of 18 April 2006 on the implementation of resolution 1559 (2004)(S/2006/248); 2S/RES/1680 (2006)",
    "2": "Reiterates its call for the full implementation of all requirements of resolution 1559 (2004);",
    "3": "Reiterates also its call on all concerned States and parties as mentioned in the report, to cooperat e fully with the Government of Lebanon, the Security Council and the Secretary-General to achieve this goal;",
    "4": "Strongly encourages the Government of Syria to respond positively to the request made by the Government of Lebanon, in line with the agreements of theLebanese national dialogue, to delineate their common border, especially in thoseareas where the border is uncertain or disputed and to establish full diplomaticrelations and representation, noting th at such measures would constitute a significant step towards asserting Lebanon’s sovereignty, territorial integrity andpolitical independence and improving the re lations between the two countries, thus contributing positively to the stability in the region, and urges both parties to makeefforts through further bilateral dialogue to this end, bearing in mind that theestablishment of diplomatic relations between States, and of permanent diplomaticmissions, takes place by mutual consent;",
    "5": "Commends the Government of Lebanon for undertaking measures against movements of arms into Lebanese territory and calls on the Government of Syria totake similar measures;",
    "6": "Welcomes the decision of the Lebanese national dialogue to disarm Palestinian militias outside refugee camps within six months, supports itsimplementation and calls for further efforts to disband and disarm all Lebanese andnon-Lebanese militias and to restore fully the Lebanese Government’s control over all Lebanese territory;",
    "7": "Reiterates its support to the Secretary-General and his Special envoy in their efforts and dedication to facilitate and assist in the implementation of all provisions of resolution 1559 (2004);",
    "8": "Decides to remain seized of the matter."
  },
  "article_count": 8,
  "cached_at": "2025-07-26 11:22:57"
}