{
  "resolution_number": "2650",
  "url": "https://undocs.org/en/S/RES/2650(2022)",
  "full_text": "United Nations S/RES/2650 (2022) \n Security Council Distr.: General \n31 August 2022 \n\n22-21218 (E) \n*2221218* \n\n Resolution 2650 (2022) \n\n Adopted by the Security Council at its 9121st meeting, on \n31 August 2022 \n\n The Security Council , \n Recalling all its previous resolutions on Lebanon, in particular resolutions 425 \n(1978) , 426 (1978) , 1559 (2004) , 1680 (2006) , 1701 (2006) , 1773 (2007) , 1832 \n(2008) , 1884 (2009) , 1937 (2010) and 2004 (2011) , 2064 (2012) , 2115 (2013) , 2172 \n(2014) and 2236 (2015) , 2305 (2016) , 2373 (2017) , 2433 (2018) , 2485 (2019) 2539 \n(2020) and 2591 (2021) as well as the statements of its President on the sit uation in \nLebanon and the Press statements dated 19 December 2016, 27 March 2018, 9 August \n2018, 8 February 2019, 27 September 2021, 4 February 2022, 25 May 2022, 7 July \n2022, \n Expressing its solidarity with Lebanon and its people in the aftermath of the \nexplosions which struck Beirut on 4 August 2020, causing a significant number of \ncasualties and wounding thousands of people, including some United Nations Interim \nForce in Lebanon (UNIFIL) personnel, and causing severe damages to commercial \nand residential infrastructures as well as to UNIFIL capacities, welcoming the \nInternational Conference on Assistance and Support to Lebanon and Beirut, organized \non the 9 August 2020 by France and the United Nations and the follow -up \nInternational Conferences organized by France and the United Nations on 2 December \n2020 and 4 August 2021, further calling the international community to reinforce its \nsupport to Lebanon and its people in that context, deploring the lack of progress of \nan independent, impartial, thorough and transparent investigation into the explosions \nby the Lebanese judicial system, and further stressing the need for such an \ninvestigation, \n Strongly urging the Lebanese political leaders to form, without further delay and \nwith a sense of urgency, a new Gove rnment which can respond to the needs and \naspirations of the Lebanese population and the current main challenges Lebanon is \nfacing, in particular the implementation of reforms, which are absolutely necessary \nto overcome and recover from the current and unp recedented acute social, economic \nand humanitarian crises, expressing grave concern about the obstacles to the political \nprocess and implementation of the necessary reforms, and calling on the Lebanese \nleaders to prioritize the national interest and ensure adherence to the constitutional \ncalendar so that the presidential election takes place on time, \n Stressing the urgent need for the Lebanese authorities to respond to the \naspirations of the Lebanese people and the intensity of the compounding crises by th e \nS/RES/2650 (2022) \n\n22-21218 2/9 \n urgent implementation of previously outlined tangible reforms that would enable the \nquick conclusion of an agreement with the IMF and the implementation of the \ncommitments made by Lebanon in the framework of the CEDRE conference of \n6 April 2018 as well a s the International Support Group for Lebanon meeting in Paris \non 11 December 2019, reiterating support to Lebanon to help it exit the current crisis \nand to address the economic, security, and humanitarian challenges, underlining the \nimportance of deliveri ng reforms to ensure effective international support and calling \nupon the international community, including international organizations, to do so, \n Responding to the request of the Government of Lebanon to extend the mandate \nof the UNIFIL for a period of one year without amendment presented in a letter from \nthe Lebanese Acting Minister for Foreign Affairs and Emigrants to the Secretary -\nGeneral of 16 June 2022 and welcoming the letter from the Secretary -General to its \nPresident of 9 August 2022 ( S/2022/607 ) recommending this extension, \n Reiterating its strong support for the territorial integrity, sovereignty and \npolitical independence of Lebanon, \n Reaffirming its commitment to the full implementation of al l provisions of \nresolution 1701 (2006) , and aware of its responsibilities to help secure a permanent \nceasefire and a long -term solution as envisioned in the resolution, \n Expressing deep concern at the continued lack of progress made towards the \nestablishment of a permanent ceasefire and other key provisions of resolution 1701 \n(2006) sixteen years after its adoption, \n Calling upon all concerned par ties to strengthen their efforts, including by \nexploring concrete solutions with the Special Coordinator of the Secretary -General \nand the UNIFIL Force Commander, to fully implement all provisions of resolution \n1701 (2006) without delay, \n Expressing deep concern at all violations, both by air and ground, in connection \nwith resolution 1701 (2006) as underlined by the Secretary -General in his reports, \nand recalling the importance of control of the Government of Lebanon over all \nLebanese territory, \n Underlining the risk that violations of the cessation of hostilities could lead to \na new conflict that none of the parties or the region can afford, \n Urging all parties to make every effort to ensure that the cessation of hostilities \nis sustained, exercise maximum calm and restraint and refrain from any action or \nrhetoric that could jeopardize the cessation of hostilities or destabilize the region, \n Condemni ng the incidents of August -September 2019, 14 April 2020, 17 April \n2020, 27 July 2020 May 2021, 20 July 2021, 4 –6 August 2021 and 25 April 2022 \nwhich occurred across the Blue Line, calling on the parties to resort to the Tripartite \nMechanism when such inci dents occur, and further commending the liaison and \nprevention role played by UNIFIL allowing for de -escalation, \n Emphasizing to all parties the importance of full compliance with the \nprohibition on sales and supply of arms and related materiel establishe d by resolution \n1701 (2006) , and reiterating its call for the Government of Lebanon to secure its \nborders and other entry points to prevent the entry in Lebanon without its consent of \narms or related m ateriel and for UNIFIL, as authorized in paragraph 11 of resolution \n1701 (2006) to assist the Government of Lebanon at its request, \n Reiterating the importance of the extension of the control of the Go vernment of \nLebanon over all Lebanese territory in accordance with the provisions of resolution \n1559 (2004) and resolution 1680 (2006) , and of the relevant provisions of the Taif \nAccords, \n S/RES/2650 (2022) \n\n3/9 22-21218 \n Encouraging all Lebanese parties to resume discussions towards a consensus on \na National Defence Strategy through a national dialogue as called for by the President \nof Lebanon on 27 December 2021, in accordance w ith relevant Security Council \nresolutions and the Taif Agreement, \n Recalling the utmost importance that all parties concerned respect the Blue Line \nin its entirety, noting with concern the recent installation of containers along the Blue \nLine which restri ct UNIFIL’s access to, or visibility of, the Blue Line, also noting \nwith great and increasing concern that UNIFIL still has not been able to access all \nrelevant locations north of the Blue Line related to the discovery of tunnels crossing \nthe Blue Line whi ch UNIFIL reported as a violation of resolution 1701 (2006) , and \nurging the Lebanese authorities to urgently conclude all necessary investigations on \nthe matter, in line with resolution 1701 (2006) , \n Noting the lack of progress in the marking of the Blue Line, encouraging the \nparties to resume and accelerate their efforts in coordination with UNIFIL, including \nthrough the tripartite mechanism, to c ontinue working in the ongoing process to \ndelineate and visibly mark the Blue Line in its entirety, as well as to move forward \non the marking of its points of contention, as recommended by the Strategic Review, \nand encouraging all parties to refrain from a ny unilateral action which could risk \nundermining the integrity of the Blue Line, \n Condemning in the strongest terms all attempts to threaten the security and \nstability of Lebanon, \n Reaffirming its determination to ensure that no acts of intimidation pre vent \nUNIFIL from implementing its mandate in accordance with Security Council \nresolution 1701 (2006) , recalling the necessity for all parties to ensure that UNIFIL \npersonnel are secure and their freedo m of movement is fully respected and unimpeded \nand continues to respect the separate, supporting mandate under which Observer \nGroup Lebanon operates, condemning in the strongest terms all attempts to restrict \nthe freedom of movement of UNIFIL’s personnel, all acts of harassment and \nintimidation and all attacks against peacekeepers, including the attacks against \nUNIFIL forces on 4 August 2018 near the town of Majdal Zun, on 25 May 2020 in \nthe town of Belida Southern Lebanon, and on the 10 February 2020, in B rashit, on \n22 December 2021 in Shaqra, on 4 January in Bint Jubayl, on 13 January in Ayta al \nSha’b and on 25 January in Ramiyah, \n Urging the Lebanese authorities to swiftly provide UNIFIL with further updates \non the actions taken and finalise investigation s on these matters, and taking note of \nthe hearings of the appeals in the Military Cassation Court against the 24 March 2021 \nverdict by the Permanent Military Court with respect to two serious attacks against \nUNIFIL peacekeepers on 26 July and 9 December 2 011, \n Recalling the importance of ensuring the protection of children and taking \nappropriate measures in this regard, in line with relevant Security Council resolutions \non Children and armed conflict, \n Recalling the relevant principles contained in the C onvention on the Safety of \nUnited Nations and Associated Personnel, \n Commending the active role and dedication of the personnel of UNIFIL and \nexpressing its strong appreciation to Member States that contribute to UNIFIL and \nunderlining the necessity that UNIFIL has at its disposal all necessary means and \nequipment to carry out its mandate, \n Recognizing that UNIFIL has successfully implemented its mandate since 2006 \nand has allowed for maintaining peace and security since then, \nS/RES/2650 (2022) \n\n22-21218 4/9 \n Recalling the request from the Government of Lebanon to deploy an \ninternational force to assist it to exercise its authority throughout the territory, and \nreaffirming UNIFIL’s authority to take all necessary action in areas of operations of \nits forces and as it dee ms within its capabilities, to ensure that its area of operations \nis not utilized for hostile activities of any kind and to resist attempts by forceful means \nto prevent it from discharging its mandate, \n Welcoming the crucial role played by the Lebanese Ar med Forces and security \nforces, as the only legitimate armed forces in Lebanon, in extending and sustaining \nthe authority of the Government of Lebanon, in particular in southern Lebanon, and \nresponding to other security challenges, including the threat of terrorism, and the \nstrong international commitment to support the Lebanese Armed Forces, which has \nhelped strengthen the capability of the Lebanese Armed Forces to provide security \nfor Lebanon, strongly urging further and increased international support to the \nLebanese Armed Forces in the context of the current economic crisis, and further \nnoting the relevance of this increased capacity in relation to their efforts to coordinate \nwith UNIFIL in the implementation of the UNIFIL mandate, and calling upon \nMembe r States to urgently assist the Lebanese Armed Forces as needed to enable it \nto perform its duties in line with resolution 1701 (2006) , \n Expressing concern about the strong negative impact of the curr ent social, \neconomic and humanitarian crises on the capacities of the Lebanese Armed Forces \nand security forces, \n Recalling resolution 2378 (2017) and its request of the Secretary -General to \nensure th at data related to the effectiveness of peacekeeping operations, including \npeacekeeping performance data, is used to improve analytics and the evaluation of \nmission operations, based on clear and well identified benchmarks, further recalling \nresolution 2436 (2018) and its request of the Secretary -General to ensure that \ndecisions to recognize and incentivize outstanding performance and decisions \nregarding deployment, remediation, training, withholding of financial \nreimbursement, and repatriation of uniformed or dismissal of civilian personnel, are \npredicated on objective performance data, and emphasizing the need to regularly \nevaluate UNIFIL’s performance such that the mission retains the skills and flexi bility \nneeded to effectively carry out its mandate, \n Also recalling resolution 2242 (2015) and its request of the Secretary -General \nto initiate, in collaboration with Member States, a revised strategy , within existing \nresources, to double the number of women in military and police contingents of UN \npeacekeeping operations, \n Emphasizing the need to regularly review all peacekeeping operations to ensure \nefficiency and effectiveness, including reviews of UNIFIL when appropriate, taking \ninto account developments on the ground, \n Bearing in mind the strategic priorities and recommendations identified by the \nSecretary -General in his letter of 12 March 2012 ( S/2012/151 ) as a result of the \nStrategic Review of UNIFIL, taking note of his letter of 8 March 2017 ( S/2017/202 ) \nas a result of the most recent Strategic Review of UNIFIL, and expressing the need \nfor a follow -up and update, \n Welcoming the Secretary -General’s 1 June 2020 Assessment of UNIFIL and \nnoting with appreciation the recommendations to further increase the efficiency and \neffectiveness of UNIFIL, \n Determining that the situation in Lebanon continues to c onstitute a threat to \ninternational peace and security, \n 1. Decides to extend the present mandate of UNIFIL until 31 August 2023; \n S/RES/2650 (2022) \n\n5/9 22-21218 \n 2. Commends the positive role of UNIFIL, whose deployment together with \nthe Lebanese Armed Forces has helped to establish a new strategic environment in \nsouthern Lebanon, welcomes the expansion of coordinated activities between UNIFIL \nand the Lebanese Armed Forces, and calls for further enhancement of this cooperation \nwithout prejudice to UNIFIL’s mandate; \n 3. Affirms its str ong continuing commitment to the existing UNIFIL mandate \nand calls for the full implementation of resolution 1701 (2006) ; \n 4. Reiterates its call for Israel and Lebanon to support a permanent ceasefir e \nand a long -term solution based on the principles and elements set out in paragraph 8 \nof resolution 1701 (2006) ; \n 5. Strongly reaffirms the necessity of an effective and durable deployment of \nthe Lebanese Armed Forces in southern Lebanon and the territorial waters of Lebanon \nat an accelerated pace to fully implement the provisions of resolution 1701 (2006) \nand requests the Secretary -General to include in his future reports assessments of \nprogress made in this regard and calls for renewed engagement of UNIFIL and the \nLebanese Armed Forces in the Strategic Dialogue, which aims at carryin g out analysis \nof ground forces and maritime assets and setting a series of benchmarks reflecting the \ncorrelation between the capacities and responsibilities of UNIFIL vis -à-vis those of \nthe Lebanese Armed Forces; \n 6. Reiterates its request for precise benchmarks and timelines to be jointly \nand promptly elaborated by the Lebanese Armed Forces and the Secretary -General, \nfor the deployments in paragraph 5, with a view to identifying Lebanese Armed \nForces progress in implementing ta sks mandated in resolution 1701 (2006) ; \n 7. Reiterates its call for the Government of Lebanon to present a plan to \nincrease its naval capabilities as soon as possible, including with appropriate suppo rt \nfrom the international community, with the goal of ultimately decreasing UNIFIL’s \nMaritime Taskforce and transitioning its responsibilities to the Lebanese Armed \nForces (LAF), in close conjunction with the effective build -up of the capabilities of \nthe L ebanese Navy, takes note in that regard of the letter dated 12 March 2019 to the \nUnited Nations outlining the commitment of the Government of Lebanon and \nwelcomes its ongoing efforts towards that goal; takes note of the impact of the Beirut \nexplosions on 4 August 2020 on the operations of the LAF; \n 8. Welcomes the report of the Secretary -General on the assessment of the \ncontinued relevance of UNIFIL’s resources and options for improving the efficiency \nand effectiveness between UNIFIL and UNSCOL, taking int o consideration the troop \nceiling and the civilian component of UNIFIL ( S/2020/473 ) and requests the \nSecretary -General to continue the implementation of his detailed plan, with timelines \nand specific modalit ies, in full and close consultation with the parties, including \nLebanon, the troop -contributing countries and the Members of the Security Council, \nto implement recommendations, as appropriate, and further requests him to \nperiodically update the Security Co uncil on this process; \n 9. Strongly encourages the Government of Lebanon to accelerate its \ndeployment of a model regiment and an offshore patrol vessel in UNIFIL’s area of \noperations to advance the implementation of resolution 1701 (2006) and the authority \nof the Lebanese State, recalls in this regard the joint statement issued at the end of \nthe 15 March 2018 Rome Conference, in particular Lebanon’s concept for a new \nModel Regiment proposed in the cont ext of the ongoing Strategic Dialogue between \nthe LAF and UNIFIL, welcomes the inauguration of the model regiment headquarters \non 13 June 2022, calls upon the Lebanese Armed Forces to work towards a full \ndeployment of model regiment troops at the earliest opportunity, including with the \nS/RES/2650 (2022) \n\n22-21218 6/9 \n meaningful participation of women military personnel, and calls on the Lebanese \nArmed Forces and UNIFIL to strengthen their coordinated actions; \n 10. Strongly urges further and increased international support for the Lebane se \nArmed Forces and all state security institutions, which are the only legitimate armed \nforces of Lebanon, in response to the capabilities development plan of the Lebanese \nArmed Forces, as well as in the framework of the International Support Group for \nLebanon, through additional and expedited assistance in areas where the Lebanese \nArmed Forces are most critically in need of support, including daily logistical needs \nand maintenance, counter -terrorism, border protection and naval capacity; \n 11. Further requ ests UNIFIL, in line with resolution 1701 and following the \nletter of the Government of Lebanon of 15 March 2022 addressed to the Presidency \nof the Security Council as well as per the recommendations of the Secretary -General \n(S/2022/556 ), to exceptionally extend temporary and special measures, that should \nnot be considered as a precedent in the future nor a long term solution, to support and \nassist the Lebanese Armed Forces with the provision of relevant addi tional non -lethal \nmaterial (fuel, food and medicine) and logistical support for a period of six months \nand no longer than 28 February 2023 , within the existing resources and without \nimplications to the increase of the budget level, for the LAF -UNIFIL join t activities \nand in compliance with the United Nations Human Rights Due Diligence Policy, and \nwithout prejudice to the mandate and its implementation, the concept of operations \nand rules of engagement of UNIFIL, while fully respecting Lebanese sovereignty and \nat the request of the Lebanese authorities, and that such support be subject to \nappropriate and immediate oversight and scrutiny, \n 12. Condemns all violations of the Blue Line, both by air and ground, and \nstrongly calls upon all parties to respect the cessation of hostilities, to prevent any \nviolation of the Blue Line and to respect it in its entirety, and to cooperate fully with \nthe United Nations and UNIFIL; \n 13. Welcomes the constructive role played by the Tripartite Mechanism in \nfacilitating coordi nation and in de -escalating tensions, and recognizes the mission \nleadership’s active efforts, which has helped to further stabilize the situation along \nthe Blue Line and build trust between the parties, expresses in this regard strong \nsupport for the conti nued efforts of UNIFIL to engage with both parties to facilitate \nliaison, coordination, and practical arrangements on the ground and to continue to \nensure that the Tripartite Mechanism enables the parties to discuss a wider range of \nissues, and encourages UNIFIL, in close coordination with the parties, to implement \nmeasures to further reinforce the capacities of the Tripartite mechanism, including the \ncreation of additional ad hoc sub -committees, as recommended in the assessment \nreport of the Secretary -Gene ral, strongly urges the parties to make a systematic, \nconstructive and expanded use of the Tripartite mechanism, including the sub -\ncommittee on the marking of the Blue Line and additional ad hoc sub -committees and \nto accelerate efforts to delineate and vis ibly mark the Blue Line in its entirety, as well \nas to move forward on resolving points of contention; \n 14. Stresses the need to foster enhanced cooperation between UNIFIL and the \nOffice of the United Nations Special Coordinator for Lebanon (UNSCOL), with the \ngoal of improving the effectiveness and efficiency of the missions, welcomes in this \nregard the improvements accomplished by the United Nations in terms of efficiencies \nand effectiveness between UNIFIL and UNSCOL and encourages the Secretary -\nGeneral t o further these efforts; \n 15. Urges all parties to abide scrupulously by their obligation to respect the \nsafety of UNIFIL and other United Nations personnel, calls on them to take all \nappropriate measures to enhance the safety and security of United Nation s personnel \nand equipment, and reiterates its call for closer cooperation between UNIFIL and the \n S/RES/2650 (2022) \n\n7/9 22-21218 \n Lebanese Armed Forces in particular regarding coordinated and adjacent patrols, \nwelcomes the commitment of the Lebanese authorities to protect UNIFIL movements \nand access, and reiterates its call for the rapid finalization of the investigations \nlaunched by Lebanon regarding all attacks against UNIFIL and its personnel, in \nparticular the incidents of 4 August 2018, 10 February 2020, 22 December 2021, 4, \n13 and 25 January 2022 in UNIFIL’s area of operations in order to swiftly bring to \njustice the perpetrators of these attacks, recalls the necessity for the Lebanese \nauthorities to investigate all attacks against UNIFIL and its personnel in line with \nresolution 2589 (2021) and bring to justice the perpetrators of those incidents in \naccordance with the Lebanese law and requests the Secretary -General to report to the \nCouncil, within a reasonable timeframe, when such incidents occur as well as, when \nappropriate, on the follow -up of the related pending investigations; \n 16. Urges all parties to cooperate fully with the Head of Mission and UNIFIL \nin the implementation of resolution 1701, as well as to ensure that the freedom of \nmovement of UNIFIL in all its operations and UNIFIL’ s access to the Blue Line in all \nits parts is fully respected and unimpeded, in conformity with its mandate and its rules \nof engagement, including by avoiding any course of action which endangers United \nNations personnel, reaffirms that, pursuant to the Ag reement on the Status of the \nUnited Nations Interim Forces in Lebanon (SOFA) between the Government of \nLebanon and the United Nations, UNIFIL does not require prior authorization or \npermission to undertake its mandated tasks and that UNIFIL is authorized t o conduct \nits operation independently, condemns in the strongest terms all attempts to deny \naccess or restrict the freedom of movement of UNIFIL’s personnel and all attacks on \nUNIFIL personnel and equipment as well as acts of harassment and intimidation of \nUNIFIL personnel and disinformation campaigns against UNIFIL; calls on the \nGovernment of Lebanon to facilitate UNIFIL’s prompt and full access to sites \nrequested by UNIFIL for the purpose of swift investigation, including all relevant \nlocations north of t he Blue Line related to the discovery of tunnels crossing the Blue \nLine which UNIFIL reported as a violation of resolution 1701 (2006) , in line with \nresolution 1701, while respecting the Lebanese Sover eignty; \n 17. Demands the parties cease any restrictions and hindrances to the \nmovement of UNIFIL personnel and guarantee the freedom of movement of UNIFIL, \nincluding by allowing announced and unannounced patrols; \n 18. Requests the Secretary -General to con tinue to take all appropriate \nmeasures to review and enhance the safety and security of peacekeeping personnel of \nUNIFIL, in line with resolution 2518 (2020) , the Action Plan on improving safety and \nsecurity related to the report on “Improving Security of United Nations Peacekeepers” \nand other relevant Security Council resolutions; \n 19. Urges all parties to cooperate fully with the Security Council and the \nSecretary -General to make tangible progress to wards a permanent ceasefire and a \nlong -term solution as envisioned in resolution 1701 (2006) and on all outstanding \nissues in the implementation of Security Council resolutions 1701 (2006) , 1680 \n(2006) and 1559 (2004) , and other relevant Security Council resolutions; \n 20. Urges the Governme nt of Israel to expedite the withdrawal of its army \nfrom northern Ghajar without further delay in coordination with UNIFIL, which has \nactively engaged Israel and Lebanon to facilitate such a withdrawal; \n 21. Reaffirms its call on all States to fully suppo rt and respect the \nestablishment between the Blue Line and the Litani River of an area free of any armed \npersonnel, assets and weapons other than those of the Government of Lebanon and \nUNIFIL; \nS/RES/2650 (2022) \n\n22-21218 8/9 \n 22. Condemns the continued maintenance of arms outside the co ntrol of the \nLebanese State by armed groups in violation of resolution 1701 (2006) and recalls \nparagraph 15 of resolution 1701 (2006) according to which all States shall take the \nnecessary measures to prevent, by their nationals or from their territories or using flag \nvessels or aircraft, the sale or supply of arms and related materiel to any entity or \nindividual in Lebanon other than those authoriz ed by the Government of Lebanon or \nUNIFIL; \n 23. Acting in support of a request from the Government of Lebanon to deploy \nan international force to assist it to exercise its authority throughout the territory, \nrecalls its authorization to UNIFIL to take all necessary action in areas of deployment \nof its forces and as it deems within its capabilities, to ensure that its area of operations \nis not utilized for hostile activities of any kind, to resist attempts by forceful means \nto prevent it from discharging it s duties under the mandate of the Security Council, \nand to protect United Nations personnel, facilities, installations and equipment, \nensure the security and freedom of movement of United Nations personnel, \nhumanitarian workers and, without prejudice to th e responsibility of the Government \nof Lebanon, to protect civilians under imminent threat of physical violence; \n 24. Commends UNIFIL’s operational changes in line with resolution 2373 \n(2017) and resol ution 2433 (2018) and reiterates its request that the Secretary -\nGeneral look at ways to enhance UNIFIL’s efforts as regards paragraph 12 of \nresolution 1701 (2006) and paragraph 14 of this resolution, including ways to increase \nUNIFIL’s visible presence, including through patrols and inspections, within its \nexisting mandate and capabilities, requests UNIFIL to improve its communication \nefforts to sup port the implementation of its mandate, enhance its protection, and raise \nawareness on its mandate, its role, and its authority to operate independently, as well \nas to underscore the role and responsibilities of the Lebanese authorities in line with \nresolu tion 1701, and to prioritize the development of a strategic communications \nstrategy outlining how it will improve these efforts, and requests UNIFIL to \nstrengthen its efforts to monitor and to counter disinformation and misinformation \nthat might hinder the mission’s ability to implement its mandate or threaten the safety \nand security of peacekeepers and to develop a strategy to counter disinformation and \nmisinformation ; \n 25. Recalls the decision that UNIFIL shall assist the government of Lebanon, \nat its request, as set out in paragraph 14 of resolution 1701 (2006) and within its \ncapabilities, to implement resolution 1701 (2006) ; \n 26. Welcomes the efforts being undertaken by UNIFIL to implement the \nSecretary -General’s zero -tolerance policy on sexual exploitation and abuse and to \nensure full compliance of its personnel with the United Nations code of conduct, \nrequests the Secretary -General to continue to take necessary measures to ensure full \ncompliance of all personnel, civilian and uniformed, in UNIFIL with the United \nNations zero -tolerance policy on sexual exploitation and ab use and to keep the \nSecurity Council fully informed about the Mission’s progress in this regard, stresses \nthe need to prevent such exploitation and abuse and to improve how allegations are \naddressed in line with its resolution 2272 (2016) , and urges troop -contributing \ncountries to continue taking appropriate preventative action, including vetting of all \npersonnel, pre -deployment and in -mission awareness training, and to take appropriate \nsteps to ensure full accountability in cases of such conduct involving their personnel, \nincluding through timely investigations of allegations, as appropriate, and to hold \nperpetrators accountable and repatriate units when there is credible evidence of \nwidespread or syste mic sexual exploitation and abuse by those units; \n 27. Requests UNIFIL to take fully into account gender considerations as a \ncross -cutting issue throughout its mandate and to assist the Lebanese authorities in \n S/RES/2650 (2022) \n\n9/9 22-21218 \n ensuring the full, equal, effective and meani ngful participation, involvement and \nrepresentation of women at all levels of decision -making in all efforts for the \nmaintenance and promotion of peace and security, including in the security sector, \nfurther requests continued reporting by UNIFIL to the Se curity Council on this issue, \nand request UNIFIL to continue supporting these efforts within its mandate welcomes \nthe continued progress made to implement Lebanon’s first National Action Plan on \nWomen, Peace and Security, commends the increase in women’s p articipation in the \nLAF Military Academy and encourages the Government of Lebanon to continue to \nfully implement its National Action Plan, with the support of the United Nations and \nwomen’s civil society organizations, as soon as possible, including to pre vent and \nrespond to sexual and gender based violence and to increase women’s representation \nin all levels of Lebanon’s security forces and government s; \n 28. Requests the Secretary -General and the troop -contributing countries to \nseek to increase the numb er of women in UNIFIL, as well as to ensure the full, \neffective and meaningful participation of women in all aspects of operations and to \nimplement relevant provisions of resolution 2538 (2020) in this regard; \n 29. Requests the Secretary -General, in the planning and conduct of UNIFIL’s \noperations, to implement peacekeeping performance requirements under resolutions \n2378 (2017) and 2436 (2018) ; \n 30. Requests the Secretary -General to continue to report to the Council on the \nimplementation of resolution 1701 (2006) , every four months, or at an y time as he \ndeems appropriate, and to include in his reporting a prompt and detailed breakdown \nof all resolution 1701 (2006) violations, clarifications by the parties and updates on \nall efforts to hol d perpetrators of such violations accountable as well as pending \ninvestigations into such violations of resolution 1701, prompt and detailed reports on \nviolations of the sovereignty of Lebanon, on restrictions to UNIFIL’s freedom of \nmovement, including det ails concerning requests submitted by UNIFIL to the \nLebanese authorities and any additional steps taken by UNIFIL, attacks, provocations \nand incitement to hatred and violence and disinformation and misinformation \ncampaigns against UNIFIL, an annex on the i mplementation of paragraph 11 by \n31 March 2023 and progress made in mobilization of international support for the \nLAF during this period, an enhanced annex on the implementation on the arms \nembargo, reports on specific areas where UNIFIL does not access an d on the reasons \nbehind these restrictions, potential risks to the cessation of hostilities and UNIFIL’s \nresponse as well as reports on progress made as regards the detailed plan on the \nimplementation of the 1 June assessment report as set out in paragraph 8 of the present \nresolution and on additional identified efficiencies to most appropriately fulfil its \nmandated tasks; measures to improve external communication of the mission and to \ncounter disinformation and misinformation; requests the Secretary -Gener al to \ncontinue to provide concrete and detailed information on the aforementioned issues \nto the Council, in line with changes to enhance reporting since the adoption of \nresolution s 2373 (2017) , 2433 (2018) , 2485 (2019) and 2539 (2020) ; \n 31. Stresses the importance of, and the need to achieve , a comprehensive, just \nand lasting peace in the Middle East, based on all its relevant resolutions including \nits resolutions 242 (1967) of 22 November 1967, 338 (1973) of 22 October 1973, \n1515 (2003) of 19 November 2003 and 1850 (2008) of 16 December 2008; \n 32. Decides to remain actively seized of the matter.",
  "articles": {
    "1": "Decides to extend the present mandate of UNIFIL until 31 August 2023; S/RES/2650 (2022) 5/9 22-21218",
    "2": "Commends the positive role of UNIFIL, whose deployment together with the Lebanese Armed Forces has helped to establish a new strategic environment in southern Lebanon, welcomes the expansion of coordinated activities between UNIFIL and the Lebanese Armed Forces, and calls for further enhancement of this cooperation without prejudice to UNIFIL’s mandate;",
    "3": "Affirms its str ong continuing commitment to the existing UNIFIL mandate and calls for the full implementation of resolution 1701 (2006) ;",
    "4": "Reiterates its call for Israel and Lebanon to support a permanent ceasefir e and a long -term solution based on the principles and elements set out in paragraph 8 of resolution 1701 (2006) ;",
    "5": "Strongly reaffirms the necessity of an effective and durable deployment of the Lebanese Armed Forces in southern Lebanon and the territorial waters of Lebanon at an accelerated pace to fully implement the provisions of resolution 1701 (2006) and requests the Secretary -General to include in his future reports assessments of progress made in this regard and calls for renewed engagement of UNIFIL and the Lebanese Armed Forces in the Strategic Dialogue, which aims at carryin g out analysis of ground forces and maritime assets and setting a series of benchmarks reflecting the correlation between the capacities and responsibilities of UNIFIL vis -à-vis those of the Lebanese Armed Forces;",
    "6": "Reiterates its request for precise benchmarks and timelines to be jointly and promptly elaborated by the Lebanese Armed Forces and the Secretary -General, for the deployments in paragraph 5, with a view to identifying Lebanese Armed Forces progress in implementing ta sks mandated in resolution 1701 (2006) ;",
    "7": "Reiterates its call for the Government of Lebanon to present a plan to increase its naval capabilities as soon as possible, including with appropriate suppo rt from the international community, with the goal of ultimately decreasing UNIFIL’s Maritime Taskforce and transitioning its responsibilities to the Lebanese Armed Forces (LAF), in close conjunction with the effective build -up of the capabilities of the L ebanese Navy, takes note in that regard of the letter dated 12 March 2019 to the United Nations outlining the commitment of the Government of Lebanon and welcomes its ongoing efforts towards that goal; takes note of the impact of the Beirut explosions on 4 August 2020 on the operations of the LAF;",
    "8": "Welcomes the report of the Secretary -General on the assessment of the continued relevance of UNIFIL’s resources and options for improving the efficiency and effectiveness between UNIFIL and UNSCOL, taking int o consideration the troop ceiling and the civilian component of UNIFIL ( S/2020/473 ) and requests the Secretary -General to continue the implementation of his detailed plan, with timelines and specific modalit ies, in full and close consultation with the parties, including Lebanon, the troop -contributing countries and the Members of the Security Council, to implement recommendations, as appropriate, and further requests him to periodically update the Security Co uncil on this process;",
    "9": "Strongly encourages the Government of Lebanon to accelerate its deployment of a model regiment and an offshore patrol vessel in UNIFIL’s area of operations to advance the implementation of resolution 1701 (2006) and the authority of the Lebanese State, recalls in this regard the joint statement issued at the end of the 15 March 2018 Rome Conference, in particular Lebanon’s concept for a new Model Regiment proposed in the cont ext of the ongoing Strategic Dialogue between the LAF and UNIFIL, welcomes the inauguration of the model regiment headquarters on 13 June 2022, calls upon the Lebanese Armed Forces to work towards a full deployment of model regiment troops at the earliest opportunity, including with the S/RES/2650 (2022) 22-21218 6/9 meaningful participation of women military personnel, and calls on the Lebanese Armed Forces and UNIFIL to strengthen their coordinated actions;",
    "10": "Strongly urges further and increased international support for the Lebane se Armed Forces and all state security institutions, which are the only legitimate armed forces of Lebanon, in response to the capabilities development plan of the Lebanese Armed Forces, as well as in the framework of the International Support Group for Lebanon, through additional and expedited assistance in areas where the Lebanese Armed Forces are most critically in need of support, including daily logistical needs and maintenance, counter -terrorism, border protection and naval capacity;",
    "11": "Further requ ests UNIFIL, in line with resolution 1701 and following the letter of the Government of Lebanon of 15 March 2022 addressed to the Presidency of the Security Council as well as per the recommendations of the Secretary -General (S/2022/556 ), to exceptionally extend temporary and special measures, that should not be considered as a precedent in the future nor a long term solution, to support and assist the Lebanese Armed Forces with the provision of relevant addi tional non -lethal material (fuel, food and medicine) and logistical support for a period of six months and no longer than 28 February 2023 , within the existing resources and without implications to the increase of the budget level, for the LAF -UNIFIL join t activities and in compliance with the United Nations Human Rights Due Diligence Policy, and without prejudice to the mandate and its implementation, the concept of operations and rules of engagement of UNIFIL, while fully respecting Lebanese sovereignty and at the request of the Lebanese authorities, and that such support be subject to appropriate and immediate oversight and scrutiny,",
    "12": "Condemns all violations of the Blue Line, both by air and ground, and strongly calls upon all parties to respect the cessation of hostilities, to prevent any violation of the Blue Line and to respect it in its entirety, and to cooperate fully with the United Nations and UNIFIL;",
    "13": "Welcomes the constructive role played by the Tripartite Mechanism in facilitating coordi nation and in de -escalating tensions, and recognizes the mission leadership’s active efforts, which has helped to further stabilize the situation along the Blue Line and build trust between the parties, expresses in this regard strong support for the conti nued efforts of UNIFIL to engage with both parties to facilitate liaison, coordination, and practical arrangements on the ground and to continue to ensure that the Tripartite Mechanism enables the parties to discuss a wider range of issues, and encourages UNIFIL, in close coordination with the parties, to implement measures to further reinforce the capacities of the Tripartite mechanism, including the creation of additional ad hoc sub -committees, as recommended in the assessment report of the Secretary -Gene ral, strongly urges the parties to make a systematic, constructive and expanded use of the Tripartite mechanism, including the sub - committee on the marking of the Blue Line and additional ad hoc sub -committees and to accelerate efforts to delineate and vis ibly mark the Blue Line in its entirety, as well as to move forward on resolving points of contention;",
    "14": "Stresses the need to foster enhanced cooperation between UNIFIL and the Office of the United Nations Special Coordinator for Lebanon (UNSCOL), with the goal of improving the effectiveness and efficiency of the missions, welcomes in this regard the improvements accomplished by the United Nations in terms of efficiencies and effectiveness between UNIFIL and UNSCOL and encourages the Secretary - General t o further these efforts;",
    "15": "Urges all parties to abide scrupulously by their obligation to respect the safety of UNIFIL and other United Nations personnel, calls on them to take all appropriate measures to enhance the safety and security of United Nation s personnel and equipment, and reiterates its call for closer cooperation between UNIFIL and the S/RES/2650 (2022) 7/9 22-21218 Lebanese Armed Forces in particular regarding coordinated and adjacent patrols, welcomes the commitment of the Lebanese authorities to protect UNIFIL movements and access, and reiterates its call for the rapid finalization of the investigations launched by Lebanon regarding all attacks against UNIFIL and its personnel, in particular the incidents of 4 August 2018, 10 February 2020, 22 December 2021, 4, 13 and 25 January 2022 in UNIFIL’s area of operations in order to swiftly bring to justice the perpetrators of these attacks, recalls the necessity for the Lebanese authorities to investigate all attacks against UNIFIL and its personnel in line with resolution 2589 (2021) and bring to justice the perpetrators of those incidents in accordance with the Lebanese law and requests the Secretary -General to report to the Council, within a reasonable timeframe, when such incidents occur as well as, when appropriate, on the follow -up of the related pending investigations;",
    "16": "Urges all parties to cooperate fully with the Head of Mission and UNIFIL in the implementation of resolution 1701, as well as to ensure that the freedom of movement of UNIFIL in all its operations and UNIFIL’ s access to the Blue Line in all its parts is fully respected and unimpeded, in conformity with its mandate and its rules of engagement, including by avoiding any course of action which endangers United Nations personnel, reaffirms that, pursuant to the Ag reement on the Status of the United Nations Interim Forces in Lebanon (SOFA) between the Government of Lebanon and the United Nations, UNIFIL does not require prior authorization or permission to undertake its mandated tasks and that UNIFIL is authorized t o conduct its operation independently, condemns in the strongest terms all attempts to deny access or restrict the freedom of movement of UNIFIL’s personnel and all attacks on UNIFIL personnel and equipment as well as acts of harassment and intimidation of UNIFIL personnel and disinformation campaigns against UNIFIL; calls on the Government of Lebanon to facilitate UNIFIL’s prompt and full access to sites requested by UNIFIL for the purpose of swift investigation, including all relevant locations north of t he Blue Line related to the discovery of tunnels crossing the Blue Line which UNIFIL reported as a violation of resolution 1701 (2006) , in line with resolution 1701, while respecting the Lebanese Sover eignty;",
    "17": "Demands the parties cease any restrictions and hindrances to the movement of UNIFIL personnel and guarantee the freedom of movement of UNIFIL, including by allowing announced and unannounced patrols;",
    "18": "Requests the Secretary -General to con tinue to take all appropriate measures to review and enhance the safety and security of peacekeeping personnel of UNIFIL, in line with resolution 2518 (2020) , the Action Plan on improving safety and security related to the report on “Improving Security of United Nations Peacekeepers” and other relevant Security Council resolutions;",
    "19": "Urges all parties to cooperate fully with the Security Council and the Secretary -General to make tangible progress to wards a permanent ceasefire and a long -term solution as envisioned in resolution 1701 (2006) and on all outstanding issues in the implementation of Security Council resolutions 1701 (2006) , 1680 (2006) and 1559 (2004) , and other relevant Security Council resolutions;",
    "20": "Urges the Governme nt of Israel to expedite the withdrawal of its army from northern Ghajar without further delay in coordination with UNIFIL, which has actively engaged Israel and Lebanon to facilitate such a withdrawal;",
    "21": "Reaffirms its call on all States to fully suppo rt and respect the establishment between the Blue Line and the Litani River of an area free of any armed personnel, assets and weapons other than those of the Government of Lebanon and UNIFIL; S/RES/2650 (2022) 22-21218 8/9",
    "22": "Condemns the continued maintenance of arms outside the co ntrol of the Lebanese State by armed groups in violation of resolution 1701 (2006) and recalls paragraph 15 of resolution 1701 (2006) according to which all States shall take the necessary measures to prevent, by their nationals or from their territories or using flag vessels or aircraft, the sale or supply of arms and related materiel to any entity or individual in Lebanon other than those authoriz ed by the Government of Lebanon or UNIFIL;",
    "23": "Acting in support of a request from the Government of Lebanon to deploy an international force to assist it to exercise its authority throughout the territory, recalls its authorization to UNIFIL to take all necessary action in areas of deployment of its forces and as it deems within its capabilities, to ensure that its area of operations is not utilized for hostile activities of any kind, to resist attempts by forceful means to prevent it from discharging it s duties under the mandate of the Security Council, and to protect United Nations personnel, facilities, installations and equipment, ensure the security and freedom of movement of United Nations personnel, humanitarian workers and, without prejudice to th e responsibility of the Government of Lebanon, to protect civilians under imminent threat of physical violence;",
    "24": "Commends UNIFIL’s operational changes in line with resolution 2373 (2017) and resol ution 2433 (2018) and reiterates its request that the Secretary - General look at ways to enhance UNIFIL’s efforts as regards paragraph 12 of resolution 1701 (2006) and paragraph 14 of this resolution, including ways to increase UNIFIL’s visible presence, including through patrols and inspections, within its existing mandate and capabilities, requests UNIFIL to improve its communication efforts to sup port the implementation of its mandate, enhance its protection, and raise awareness on its mandate, its role, and its authority to operate independently, as well as to underscore the role and responsibilities of the Lebanese authorities in line with resolu tion 1701, and to prioritize the development of a strategic communications strategy outlining how it will improve these efforts, and requests UNIFIL to strengthen its efforts to monitor and to counter disinformation and misinformation that might hinder the mission’s ability to implement its mandate or threaten the safety and security of peacekeepers and to develop a strategy to counter disinformation and misinformation ;",
    "25": "Recalls the decision that UNIFIL shall assist the government of Lebanon, at its request, as set out in paragraph 14 of resolution 1701 (2006) and within its capabilities, to implement resolution 1701 (2006) ;",
    "26": "Welcomes the efforts being undertaken by UNIFIL to implement the Secretary -General’s zero -tolerance policy on sexual exploitation and abuse and to ensure full compliance of its personnel with the United Nations code of conduct, requests the Secretary -General to continue to take necessary measures to ensure full compliance of all personnel, civilian and uniformed, in UNIFIL with the United Nations zero -tolerance policy on sexual exploitation and ab use and to keep the Security Council fully informed about the Mission’s progress in this regard, stresses the need to prevent such exploitation and abuse and to improve how allegations are addressed in line with its resolution 2272 (2016) , and urges troop -contributing countries to continue taking appropriate preventative action, including vetting of all personnel, pre -deployment and in -mission awareness training, and to take appropriate steps to ensure full accountability in cases of such conduct involving their personnel, including through timely investigations of allegations, as appropriate, and to hold perpetrators accountable and repatriate units when there is credible evidence of widespread or syste mic sexual exploitation and abuse by those units;",
    "27": "Requests UNIFIL to take fully into account gender considerations as a cross -cutting issue throughout its mandate and to assist the Lebanese authorities in S/RES/2650 (2022) 9/9 22-21218 ensuring the full, equal, effective and meani ngful participation, involvement and representation of women at all levels of decision -making in all efforts for the maintenance and promotion of peace and security, including in the security sector, further requests continued reporting by UNIFIL to the Se curity Council on this issue, and request UNIFIL to continue supporting these efforts within its mandate welcomes the continued progress made to implement Lebanon’s first National Action Plan on Women, Peace and Security, commends the increase in women’s p articipation in the LAF Military Academy and encourages the Government of Lebanon to continue to fully implement its National Action Plan, with the support of the United Nations and women’s civil society organizations, as soon as possible, including to pre vent and respond to sexual and gender based violence and to increase women’s representation in all levels of Lebanon’s security forces and government s;",
    "28": "Requests the Secretary -General and the troop -contributing countries to seek to increase the numb er of women in UNIFIL, as well as to ensure the full, effective and meaningful participation of women in all aspects of operations and to implement relevant provisions of resolution 2538 (2020) in this regard;",
    "29": "Requests the Secretary -General, in the planning and conduct of UNIFIL’s operations, to implement peacekeeping performance requirements under resolutions 2378 (2017) and 2436 (2018) ;",
    "30": "Requests the Secretary -General to continue to report to the Council on the implementation of resolution 1701 (2006) , every four months, or at an y time as he deems appropriate, and to include in his reporting a prompt and detailed breakdown of all resolution 1701 (2006) violations, clarifications by the parties and updates on all efforts to hol d perpetrators of such violations accountable as well as pending investigations into such violations of resolution 1701, prompt and detailed reports on violations of the sovereignty of Lebanon, on restrictions to UNIFIL’s freedom of movement, including det ails concerning requests submitted by UNIFIL to the Lebanese authorities and any additional steps taken by UNIFIL, attacks, provocations and incitement to hatred and violence and disinformation and misinformation campaigns against UNIFIL, an annex on the i mplementation of paragraph 11 by 31 March 2023 and progress made in mobilization of international support for the LAF during this period, an enhanced annex on the implementation on the arms embargo, reports on specific areas where UNIFIL does not access an d on the reasons behind these restrictions, potential risks to the cessation of hostilities and UNIFIL’s response as well as reports on progress made as regards the detailed plan on the implementation of the 1 June assessment report as set out in paragraph 8 of the present resolution and on additional identified efficiencies to most appropriately fulfil its mandated tasks; measures to improve external communication of the mission and to counter disinformation and misinformation; requests the Secretary -Gener al to continue to provide concrete and detailed information on the aforementioned issues to the Council, in line with changes to enhance reporting since the adoption of resolution s 2373 (2017) , 2433 (2018) , 2485 (2019) and 2539 (2020) ;",
    "31": "Stresses the importance of, and the need to achieve , a comprehensive, just and lasting peace in the Middle East, based on all its relevant resolutions including its resolutions 242 (1967) of 22 November 1967, 338 (1973) of 22 October 1973, 1515 (2003) of 19 November 2003 and 1850 (2008) of 16 December 2008;",
    "32": "Decides to remain actively seized of the matter."
  },
  "article_count": 32,
  "cached_at": "2025-07-26 21:48:45"
}